,Username,CountryName,TravelDate,VisitRating,TextualReviews
316,sjohnson,Guatemala,1974-03-22,9,Debate energy religious sport.
317,sjohnson,Iraq,1955-01-23,3,Financial perform turn form single camera political economic.
318,sjohnson,Kingdom of the Netherlands,2015-02-08,6,Community study into job half black because song.
319,sjohnson,Lebanon,1968-08-23,2,Administration sound teach hit lose.
320,sjohnson,Taiwan,2004-05-05,6,Instead push fast color everything.
321,carrie97,Barbados,1967-10-01,2,Protect front why ability fund front suggest drug thing.
322,carrie97,Trinidad and Tobago,2013-08-02,1,National visit hundred billion blue right.
323,carrie97,Barbados,1993-05-04,0,Boy sing threat bill pattern scientist early student range.
324,carrie97,Georgia (country),2011-04-27,7,Close election stop cold relate.
325,carrie97,Sri Lanka,1954-07-10,4,Her whether beyond bar shoulder decade rich director population.
326,carrie97,Åland Islands,2019-07-02,0,Student cost policy across inside water do get finish.
327,carrie97,Costa Rica,2014-06-13,8,General simple cost develop left poor.
328,carrie97,Sint Maarten,2001-06-26,5,Perform walk expert easy word learn military top.
329,knightamanda,Nauru,1977-09-22,0,Week own necessary allow including level well.
330,knightamanda,India,2010-10-25,9,Activity note attention yeah process rest really.
331,knightamanda,Solomon Islands,2005-12-05,10,Everything bad age local season school able pattern story.
332,knightamanda,Laos,2007-10-28,2,Region reduce ask although get poor herself population.
333,lauren16,The Bahamas,1982-06-02,10,Machine hundred a itself eye magazine.
334,lauren16,Pitcairn Islands,2005-02-16,4,Truth house try thus should wide return few.
335,lauren16,El Salvador,2001-02-15,0,Industry trial position college also keep.
336,lauren16,French Guiana,2010-10-25,6,Assume dinner former heavy person choose.
337,lauren16,Malaysia,2018-06-21,4,Simply concern page director.
338,charlesoliver,Ecuador,1975-03-05,8,Pressure would truth join.
339,charlesoliver,Ivory Coast,2009-07-17,9,Face key when also long.
340,hutchinsonethan,Ecuador,1965-04-28,4,List run safe figure hospital.
341,hutchinsonethan,Saba,1987-03-07,3,Set attack she represent family us lawyer.
342,hutchinsonethan,Comoros,1992-12-01,3,Until help attention American some before according final ability.
343,hutchinsonethan,Dominica,1956-09-05,4,Themselves test like ball cause.
344,hutchinsonethan,Madagascar,1969-03-07,5,Baby assume since break star.
345,gflores,Uruguay,2017-02-15,6,Bag list teacher would road collection big talk.
346,ystevens,Sierra Leone,2008-04-07,7,Candidate phone when room network behind social her.
347,ystevens,Honduras,2001-05-30,4,Trip no occur hotel fill not before painting.
348,bdean,Bahrain,2000-05-26,6,Wall measure again ability election race.
349,bdean,Kingdom of the Netherlands,1979-04-29,8,Control stock same project every.
350,bdean,Kiribati,1986-04-20,6,The common prevent spend food.
351,bdean,Kenya,1963-10-03,7,Soldier certain edge couple break provide drug son.
352,bdean,Belgium,1964-11-07,9,Simple wrong newspaper allow forward hour.
353,judy50,Montenegro,2008-02-17,7,Establish son turn another wonder reveal yet possible.
354,judy50,Greenland,1951-11-15,5,Dinner write usually team remember effect.
355,judy50,Samoa,1966-04-01,2,Market the particular available expect.
356,judy50,San Marino,1956-08-13,8,Accept sometimes city commercial identify on.
357,judy50,Eritrea,1977-10-02,8,Poor send through law.
358,judy50,Albania,2012-01-04,8,People friend state half sign admit hair look too.
359,judy50,Heard Island and McDonald Islands,2003-03-21,5,Address than could security including hot child investment yourself.
360,hoffmansean,Iceland,1980-01-12,2,As usually training able treat see.
361,hoffmansean,Norfolk Island,1964-04-02,5,Economy huge miss population fly.
362,hoffmansean,Bermuda,2008-07-26,1,Less economy fire education expect part age visit.
363,hoffmansean,Pakistan,2020-09-25,6,Data evening prevent image already again new weight.
364,hoffmansean,Costa Rica,1988-09-06,0,Ahead quickly hope move.
365,hoffmansean,Eritrea,2015-01-07,10,Knowledge season region little continue onto agent green.
366,hoffmansean,Croatia,1992-09-17,4,At best small law campaign value firm key.
367,hoffmansean,Tunisia,1971-11-05,10,Site suddenly man remember rich yeah simple guess.
368,danielle83,Lebanon,2020-04-26,7,Hour movement time benefit thus mean.
369,danielle83,Afghanistan,1970-08-08,5,Value create agree likely.
370,danielle83,Uzbekistan,1957-09-10,6,Pick none none ball ground.
371,danielle83,Cambodia,1968-08-02,2,Tree amount billion beyond quality fill final oil.
372,danielle83,North Macedonia,1975-05-19,2,Price little identify degree.
373,patriciakelly,Italy,2007-09-03,4,Want it manage heavy investment day.
374,patriciakelly,Cape Verde,2008-07-13,7,Side environment speak let guy son last early leave.
375,patriciakelly,Antigua and Barbuda,1968-03-04,6,Sound market best only know fish beautiful.
376,patriciakelly,Mauritius,1993-11-02,4,Evening green require bring her.
377,andrew72,Australia,1995-06-03,7,Four seven ability probably few cost.
378,andrew72,Eritrea,1972-06-16,10,When bag model employee relate anything season hospital.
379,andrew72,Honduras,2016-10-09,10,Religious around both place strong.
380,andrew72,Sahrawi Arab Democratic Republic,1963-08-06,7,Bank oil describe section few stay.
381,andrew72,Åland Islands,1974-03-28,10,Laugh environment front company speak end time trouble.
382,andrew72,Bhutan,1962-06-22,5,Pm stage short put lay too.
383,andrew72,Northern Mariana Islands,1963-03-04,5,Might someone young learn argue glass matter.
384,andrew72,Singapore,1982-04-10,7,Call share its guess.
385,dhill,Tunisia,1981-05-24,8,Follow current pay fire market.
386,dhill,Somalia,1997-07-24,1,Wind task top worry there similar adult range true.
387,dhill,Collectivity of Saint Martin,1987-10-11,0,Matter remember body keep body.
388,dhill,British Virgin Islands,2012-10-13,2,Work no none say heart information part full.
389,dhill,Burkina Faso,1995-11-05,1,Certain return suddenly wish loss cause base sure.
390,dhill,Jan Mayen,1969-08-21,5,Area traditional property she push.
391,dhill,Saudi Arabia,1982-01-31,10,Thus growth him power morning.
392,harveyalejandra,Kiribati,2000-12-02,4,Decide rest others development account knowledge action.
393,harveyalejandra,Northern Cyprus,1971-09-13,3,As player use through first.
394,harveyalejandra,Guam,1988-12-31,3,Since laugh model make speak might.
395,harveyalejandra,Panama,1992-03-27,6,Social forward provide upon yeah sense up add.
396,harveyalejandra,Ukraine,2014-05-13,9,Idea school still up radio try.
397,daniel64,Wake Island,1975-02-28,3,Couple year person understand back use me media.
398,daniel64,Jordan,1975-12-27,1,Building view its contain such approach although say.
399,daniel64,Greenland,1963-01-17,7,Third option chair decide grow.
400,daniel64,Slovenia,1964-05-28,2,Heavy by of mission parent.
401,daniel64,Fiji,2011-03-29,3,Expert cell style believe tough wait candidate under entire.
402,daniel64,Iceland,1995-01-01,10,Knowledge report national senior how.
403,daniel64,Peru,1959-04-18,3,Gas this sort unit operation.
404,michaelgriffith,Chad,1995-06-26,1,Loss manage each the.
405,cindyhayes,Macau,1958-11-08,10,Former within night want according speech personal.
406,cindyhayes,Iraq,1970-01-14,10,Yourself front season suddenly really social standard even exist.
407,cindyhayes,Saudi Arabia,2005-11-11,8,Speak lay born southern.
408,dsmith,Johnston Atoll,1991-09-21,7,Fear choose song according foot choice space.
409,dsmith,Macau,1991-06-21,7,Weight southern church inside series.
410,dsmith,Suriname,2012-06-10,9,Politics catch information where car usually growth opportunity.
411,dsmith,Maldives,1962-01-12,10,Drug dark wrong response.
412,dsmith,Serbia,1976-11-15,10,Soldier heavy enough operation.
413,dsmith,Saba,2011-02-04,2,See we find knowledge treatment development serious seat.
414,dsmith,South Georgia and the South Sandwich Islands,1952-11-01,10,Star role yard son speech Democrat wife give.
415,robinrobinson,Eswatini,1972-12-17,2,Risk exactly speak water good.
416,robinrobinson,Andorra,2002-04-04,6,Few eight your still ten.
417,manningcandace,Niue,1954-08-01,4,Statement unit in baby.
418,manningcandace,Oman,1984-10-31,0,Attack food laugh newspaper part better college to.
419,manningcandace,Turkey,1957-05-24,5,Simply degree article available possible order commercial senior.
420,manningcandace,Eswatini,1977-12-08,5,Fact scientist nothing change suffer space a would.
421,cynthiaburgess,Turkey,1996-04-29,3,Thus society oil activity include audience.
422,cynthiaburgess,Samoa,1988-11-30,7,Star feel chance although address politics training.
423,alexterry,Saint Barthélemy,2005-04-26,8,It start now family.
424,alexterry,Wake Island,1951-05-22,9,Ready lawyer attack simply protect.
425,alexterry,Slovenia,1963-03-09,0,Hotel our safe prepare blue.
426,gloverkarina,Abkhazia,1956-05-18,9,If executive success ago five information cut.
427,gloverkarina,Costa Rica,2020-10-02,4,Other question indeed message picture study customer.
428,gloverkarina,Papua New Guinea,2013-02-09,8,Nothing defense customer family food.
429,gloverkarina,Belarus,1992-04-16,8,Congress result every war something.
430,gloverkarina,Svalbard,1965-11-08,6,Window tax marriage society size improve hit nice kind.
431,gloverkarina,Kiribati,2000-03-03,5,Poor modern democratic human.
432,gloverkarina,Central African Republic,1981-05-02,6,Rock music check close agreement box people point month.
433,gloverkarina,Kingdom of the Netherlands,1975-04-10,6,Indicate actually small case middle resource project establish indicate.
434,gloverkarina,Dominican Republic,1958-12-23,10,Operation cover program reason environmental he.
435,jmartinez,Ukraine,1990-10-21,1,Yet recent grow crime.
436,jmartinez,Australia,1997-02-28,2,Drop store could her movement edge.
437,webstertony,United Kingdom,1973-10-19,10,Tough agree move analysis its body source.
438,webstertony,Niger,1978-03-03,6,Feel beat why matter instead need conference something.
439,webstertony,Trinidad and Tobago,1989-11-21,5,Community tonight east trouble two oil.
440,webstertony,Nicaragua,1983-07-21,2,Local cover interview us.
441,webstertony,Serbia,1964-11-14,3,Less physical media artist she.
442,webstertony,Belarus,2005-05-25,5,Five particular machine exist improve son less concern.
443,webstertony,Anguilla,1966-03-07,7,Discuss personal interesting phone on far must.
444,webstertony,Wake Island,1955-01-19,3,Any worry include happy thought early president board bring.
445,brownlisa,Paraguay,1970-08-09,4,Group member it chance our they.
446,brownlisa,Croatia,1997-04-24,7,Set test friend bill fire.
447,brownlisa,Uzbekistan,1984-07-20,5,Same throughout wide billion raise.
448,brownlisa,Brazil,2017-12-23,0,Friend pattern decade plant identify mention.
449,brownlisa,Ethiopia,1997-02-04,2,Yard tough employee situation red at.
450,brownlisa,Pitcairn Islands,2012-01-30,5,Although best various exactly several.
451,fmaldonado,Vietnam,1985-05-31,5,Adult run point spring room with travel responsibility.
452,fmaldonado,Saint Pierre and Miquelon,1978-03-20,0,Hour pick Mrs hundred.
453,fmaldonado,Costa Rica,1953-10-23,7,Take budget agency century strong anything trial factor culture.
454,snydertammy,Belarus,2000-01-04,9,You bar development item popular receive.
455,snydertammy,Cameroon,1989-10-29,4,Assume every walk degree.
456,snydertammy,Singapore,2012-06-15,3,Citizen able occur quite.
457,osanchez,Collectivity of Saint Martin,1957-07-29,3,Have approach difference difficult.
458,gwilson,Jordan,1985-07-27,3,Not hear pressure finish pressure recognize.
459,twilson,Austria,2019-08-28,3,During scientist white better.
460,twilson,Isle of Man,1965-03-06,0,Over before study sound.
461,twilson,Bailiwick of Guernsey,2009-11-02,4,Practice how save several model think five miss.
462,twilson,Belarus,1968-01-23,3,Federal family I miss anyone number easy hotel news.
463,twilson,Kiribati,1992-09-02,1,Start of wind white message.
464,twilson,Greenland,2012-05-11,8,Billion onto find read respond tend sea speak.
465,twilson,Panama,1995-08-08,1,Black cultural pull above us adult see body program.
466,twilson,Czech Republic,1953-07-13,8,Scientist ever travel feeling two customer season owner.
467,twilson,Cook Islands,2015-09-13,0,Former serve office owner over family.
468,deborahmartin,Hungary,1997-04-28,8,Child lead sport everything.
469,deborahmartin,Oman,1980-12-17,1,Necessary lawyer else behind upon.
470,brandon50,Sudan,1974-04-15,9,Appear economy whom forward arm prove community expect live.
471,brandon50,Sint Maarten,2019-06-13,3,Five establish per floor world give.
472,brandon50,Angola,1953-07-05,6,Store community together far enough ability citizen girl.
473,brandon50,El Salvador,1982-07-27,0,Them answer knowledge her ten.
474,brandon50,Suriname,1955-10-23,4,Agent actually whose defense compare bill should.
475,brandon50,Cyprus,2005-04-15,3,Argue bit around election modern simple ok soon four.
476,brandon50,Djibouti,1996-11-17,6,Free another mind kind religious question.
477,brandon50,Dominica,2002-11-21,3,Amount will data school no air run.
478,rachelgonzalez,Pitcairn Islands,1993-05-29,7,Sometimes drive manage management conference.
479,rachelgonzalez,Zambia,1986-07-14,8,Although well far summer game.
480,rachelgonzalez,Antigua and Barbuda,1988-02-15,8,Hospital arrive third quite beyond you.
481,rachelgonzalez,Honduras,1995-09-28,3,Close among move class often bad character cost home.
482,rachelgonzalez,Belarus,2001-01-25,5,General nor administration open act simple.
483,rachelgonzalez,Burkina Faso,2000-10-22,8,Beat offer rate half important guess what.
484,rachelgonzalez,Kosovo,1985-02-25,5,Defense modern outside voice measure.
485,rachelgonzalez,British Indian Ocean Territory,1965-12-30,9,Old nice per pattern group life land.
486,hhines,Oman,2004-07-26,4,Growth fish else social from side hear.
487,lisa92,Bulgaria,2001-09-09,2,Thank goal chance whom current old.
488,lisa92,China,2008-11-30,9,Reflect she half air important truth speak behind appear.
489,lisa92,Russia,2003-09-01,3,Person current able report director pass.
490,lisa92,Belize,2016-10-27,2,Outside work upon article compare television fly mean.
491,jopennington,Central African Republic,2011-12-17,5,Offer hope responsibility eight west.
492,jopennington,Sweden,2013-02-04,7,Look give sense fine street make case.
493,jopennington,Rwanda,1978-12-27,4,Administration expert it run travel determine someone.
494,jopennington,San Marino,2003-06-24,10,Team reveal player soon current.
495,zmorris,Bulgaria,1967-11-15,1,North product well school guess them purpose.
496,zmorris,Philippines,1969-03-11,5,Season how still general.
497,zmorris,Cape Verde,1970-03-17,3,Whatever employee remember out some left.
498,matthew94,Collectivity of Saint Martin,1978-04-24,1,Market walk also traditional score.
499,matthew94,Christmas Island,1978-05-17,10,Factor tell billion establish character decide candidate girl.
500,matthew94,Kenya,1972-06-24,0,Bit your education expert.
501,matthew94,Costa Rica,1976-02-03,1,Everything war he including.
502,matthew94,Cocos (Keeling) Islands,1996-04-25,7,Night personal sure whether visit speak ahead rock parent.
503,matthew94,South Georgia and the South Sandwich Islands,1994-01-15,8,Soon budget instead property or their that nation thousand.
504,matthew94,Jordan,1971-04-07,4,Across hit half agreement.
