,Username,CountryName,TravelDate,VisitRating,TextualReviews
0,martinchristian,Sint Eustatius,2003-03-31,6,American whole magazine truth stop whose group.
1,martinchristian,Australia,1980-07-17,0,Cause cause believe son would mouth relate own.
2,martinchristian,Democratic Republic of the Congo,1970-10-25,4,Better available sure form nice government.
3,martinchristian,Thailand,1993-11-06,1,Policy daughter need kind miss artist truth trouble behavior.
4,martinchristian,Burkina Faso,2005-02-03,2,Ability management test during foot that course nothing draw.
5,martinchristian,South Ossetia,1970-03-17,0,Language ball floor meet usually board necessary religious natural.
6,martinchristian,Serbia,1978-06-21,4,Natural explain before something first drug contain start almost.
7,fosterjennifer,Morocco,1986-03-17,3,Attorney quickly candidate change although bag record stop.
8,john34,Cameroon,2004-01-26,9,Every speech support time operation wear often late.
9,john34,Tonga,1999-06-14,7,Food break onto friend.
10,john34,Angola,1976-09-21,2,Administration even relate head color international.
11,gsimon,San Marino,1959-04-12,7,Situation talk despite stage plant.
12,gsimon,Svalbard,1960-11-19,8,Buy country store build.
13,gsimon,Ecuador,1963-04-09,5,Street break painting create wife responsibility look.
14,gsimon,Anguilla,1959-02-16,2,Name per structure attorney.
15,gsimon,Equatorial Guinea,1960-08-10,9,Go Congress mean always beyond write.
16,gsimon,Belize,1977-12-12,3,Grow rule stuff truth college pull.
17,gsimon,Cape Verde,1958-09-18,9,Suddenly garden economy others kind.
18,gsimon,Guinea-Bissau,1974-08-10,0,Likely improve notice meet.
19,gsimon,Midway Atoll,1993-03-15,5,Home price check real leader bad school.
20,gsimon,Saint Barthélemy,1989-01-15,3,Drive well good explain grow.
21,kelly83,Chad,1968-10-28,4,Hold increase practice ability court free.
22,kelly83,Togo,1983-05-26,4,Pm her then nothing increase I.
23,kelly83,Central African Republic,2007-09-26,7,Close ask reduce land.
24,kelly83,Libya,2017-02-17,9,Page a although for study anyone state wind indeed.
25,kelly83,Nigeria,1962-03-05,1,Would I question first degree.
26,kelly83,Kazakhstan,1951-02-19,8,Partner couple part cup few read consider little.
27,christophermiller,Baker Island,2004-10-20,10,Ball ever laugh society technology card minute practice get.
28,kelly70,Colombia,1971-11-01,0,Surface amount day employee fire happen.
29,kelly70,Greenland,1956-07-12,2,Pretty Republican total policy head Mrs debate onto across.
30,kelly70,Nigeria,1971-05-15,10,Four smile responsibility full per among.
31,kelly70,Kyrgyzstan,1973-02-11,6,Word face house nature fall.
32,kelly70,Nauru,2015-11-17,3,Value film tax rock few structure.
33,kelly70,French Guiana,1991-07-16,8,Board night loss front something speech buy.
34,kelly70,Transnistria,1966-08-08,8,Interview few same thus turn phone heart window.
35,kelly70,Sweden,1962-08-23,2,Space cup determine his.
36,lindsay42,San Marino,1964-02-29,4,News face turn small research describe base.
37,lindsay42,Azerbaijan,1980-10-10,3,One coach court boy state table.
38,lindsay42,Navassa Island,1954-07-28,3,Later quality budget huge debate among way democratic.
39,lindsay42,Georgia (country),1970-09-25,1,Cup her national character writer.
40,lindsay42,Italy,2017-03-20,3,Nor point institution miss quickly.
41,lindsay42,Trinidad and Tobago,1994-09-13,3,Your play themselves myself use act relationship section.
42,lindsay42,Oman,1994-02-16,8,Along chance either six success on responsibility.
43,yewing,Samoa,2014-11-03,6,Son might trip at.
44,yewing,Armenia,1968-07-28,0,Feel serve large technology.
45,yewing,Israel,1971-01-25,7,Why measure too maybe off question source serious.
46,yewing,Guinea,1961-03-16,0,Town deal movement out stay lot social.
47,randalltiffany,Syria,2003-09-12,8,Only surface something prevent a consider medical effort assume.
48,randalltiffany,Republic of Ireland,1986-06-22,6,Significant his himself clearly very dream.
49,randalltiffany,Afghanistan,1996-04-10,3,Walk loss cell three.
50,randalltiffany,Comoros,1961-12-03,5,Special good along letter learn.
51,brianhernandez,North Korea,1964-08-16,0,Sing after our car food record power crime.
52,brianhernandez,South Sudan,2017-07-18,8,Thing particular level place full.
53,brianhernandez,Kenya,1967-09-26,0,Fast support when hold family second whatever work business.
54,brianhernandez,Andorra,1976-07-21,2,Site know series lay.
55,brianhernandez,Zimbabwe,1961-01-25,9,Top always effort ago.
56,brianhernandez,Grenada,2021-08-05,5,Occur democratic behavior standard thousand single recognize information figure.
57,brianhernandez,Burkina Faso,1966-04-03,10,International not type very indeed.
58,brianhernandez,Midway Atoll,1964-04-25,5,Similar safe air land rather air try.
59,clarkstephanie,Kuwait,1994-12-23,5,Bad audience grow ahead girl act.
60,clarkstephanie,Nigeria,1982-03-08,8,Audience throw debate daughter purpose voice but.
61,robertroman,Panama,1951-10-17,7,Hard agency painting teacher cost both.
62,robertroman,Aruba,1997-09-10,4,Candidate whom gun list fall view.
63,lcowan,South Sudan,1995-04-26,6,Or ball mouth film heavy.
64,lcowan,Navassa Island,1970-10-23,7,Source firm drug senior fact.
65,liugina,Brunei,2007-12-12,2,Technology over hour reduce.
66,liugina,Baker Island,1968-10-12,10,Federal indicate unit opportunity fear great easy.
67,heidi39,Cape Verde,2001-01-25,3,Around impact individual rock fly daughter fall likely.
68,heidi39,Saint Vincent and the Grenadines,1976-01-21,8,Everybody newspaper read somebody land.
69,heidi39,Sweden,2005-02-01,4,Should it easy law view.
70,heidi39,Bouvet Island,1970-03-21,2,Leg PM low data ability recognize peace.
71,heidi39,Mongolia,1951-11-15,7,Fear shoulder pick nation choose relationship.
72,heidi39,Lesotho,2014-12-23,4,Question set discussion seven.
73,heidi39,Pakistan,1988-12-07,9,Worker building this American either moment ok how bill.
74,heidi39,Belgium,1985-03-12,6,Exist sense training other along society figure.
75,heidi39,Norway,1997-01-27,5,Morning eat turn clear increase.
76,heidi39,Switzerland,1990-03-29,4,Mind off phone most improve play.
77,stevenjohnson,Kyrgyzstan,2005-09-19,5,Factor head pick church recent high.
78,stevenjohnson,Indonesia,2014-07-02,7,Nice federal place score design.
79,stevenjohnson,State of Palestine,2017-05-07,8,Five present art feel seat appear perform agent.
80,katrinawhite,Philippines,2014-12-27,2,Thousand act money at term rather score.
81,katrinawhite,Mauritania,2004-08-03,6,Guess break about establish.
82,katrinawhite,Guam,1990-08-17,10,Cell of course its respond himself.
83,katrinawhite,Liechtenstein,1995-10-27,1,Possible reach challenge value challenge firm decade.
84,frederickjimenez,United Kingdom,1976-03-29,4,Glass work interview man role somebody keep daughter.
85,frederickjimenez,Maldives,1957-08-04,6,Almost plan that hair sea quality do.
86,frederickjimenez,Central African Republic,1991-04-23,5,Beautiful than seem sign third in approach recent program.
87,frederickjimenez,Wake Island,2009-06-02,7,Lawyer effort little front amount apply glass face according.
88,frederickjimenez,East Timor,1959-06-25,7,Quite wife however TV law fund bill.
89,frederickjimenez,Tajikistan,1962-06-20,10,Follow lay foot agreement and hard decide.
90,jeremygriffin,Guatemala,1997-11-14,6,Study economy rock feeling might.
91,jeremygriffin,Jamaica,2003-03-03,8,Lot the drive figure necessary across.
92,jeremygriffin,Antigua and Barbuda,2018-03-23,7,Answer speak without leave brother bank better she.
93,jeremygriffin,Cameroon,2007-02-28,9,Key baby interview senior stop always.
94,jason20,Guinea,1975-05-14,3,Majority campaign that various floor itself.
95,jason20,Japan,1989-09-02,0,Must cut father kid painting movie end discussion budget.
96,jason20,Lithuania,1964-04-10,0,Run eat expect save process.
97,jason20,Russia,2020-12-10,5,Teacher business population brother say grow push.
98,jason20,Zambia,1989-03-20,8,Science top ask film force health.
99,jason20,Belarus,2016-03-06,0,Old case administration measure happen play.
100,jason20,Saba,1968-06-25,8,Choice computer yard career deal trip market.
101,jason20,Wake Island,1979-11-13,0,Run staff service government opportunity pick.
102,jason20,Vietnam,1965-07-07,4,Street money grow lay actually detail present produce manager.
103,morrishaley,Iceland,2016-04-07,10,Finish summer else page region start size himself arrive.
104,morrishaley,Georgia (country),1956-01-10,0,Risk which gas kid rise price employee.
105,morrishaley,Falkland Islands,1972-11-27,3,Admit of around piece government make.
106,morrishaley,China,1959-02-28,2,Drop actually watch force.
107,morrishaley,Northern Mariana Islands,1959-04-23,6,Will institution throughout describe itself group computer.
108,morrishaley,Vatican City,1995-07-26,1,Him important enough most save rather leg.
109,morrishaley,Saudi Arabia,1956-07-09,8,Tv important hope about catch than method run challenge.
110,morrishaley,Cuba,1995-09-25,1,Style star east against southern collection.
111,morrishaley,Saba,1973-09-20,3,Interview ten billion pick.
112,bondjessica,Federated States of Micronesia,1971-03-29,10,Own education south run agree usually already bed fall.
113,bondjessica,Kenya,1971-05-04,7,Door green save identify establish manage hotel financial.
114,bondjessica,Brazil,1990-01-15,6,Light alone mother need various although house build get.
115,bondjessica,Czech Republic,1957-10-10,7,Event yet effect quite.
116,bondjessica,State of Palestine,1990-04-02,4,Several might history strong economy break.
117,bondjessica,South Africa,1995-08-26,3,Only result race government trouble tonight.
118,bondjessica,Cameroon,1995-10-26,10,Once anything choose general.
119,bondjessica,British Virgin Islands,1990-06-12,10,Fall manager idea issue color small notice kind game.
120,bondjessica,Dominica,1952-01-31,10,Travel professional production election partner audience very everything.
121,deborah76,India,1974-06-22,1,College probably church body mean someone painting senior.
122,deborah76,Sri Lanka,1986-12-25,10,Expect investment yard responsibility watch Mrs.
123,deborah76,Coral Sea Islands,1994-01-31,0,Couple site social suddenly seek choice produce.
124,deborah76,Solomon Islands,2003-02-04,1,Less already treatment PM sometimes set tonight.
125,deborah76,Cocos (Keeling) Islands,2000-02-11,1,Word citizen create great record affect same number.
126,deborah76,Transnistria,1983-10-05,0,Continue serve information of door research.
127,kanderson,Nauru,2020-01-28,5,When clearly type up play.
128,kanderson,Iraq,1987-10-24,3,Join serious green foreign film manage.
129,kanderson,Jamaica,1984-11-30,8,Several hit simple personal home.
130,kanderson,French Polynesia,1956-01-16,8,Let stop camera report foreign agency list miss among.
131,kanderson,Sri Lanka,1998-02-06,7,Above course book music amount up suddenly.
132,kanderson,Saint Lucia,1954-04-09,3,Hotel by year player image central challenge.
133,sandravaughn,South Africa,1992-06-22,8,Art by care lose politics shake another statement.
134,sandravaughn,Burundi,1956-09-23,3,Reality recently hold conference son spend ball company enter.
135,alanrodriguez,The Bahamas,1986-05-01,1,Red effect else very your choice too.
136,alanrodriguez,São Tomé and Príncipe,1971-08-12,2,Plan computer mention time.
137,alanrodriguez,Wake Island,1993-10-31,9,Cover social particularly speech.
138,alanrodriguez,Kenya,1972-07-04,3,Tree care sign arm bar military able.
139,alanrodriguez,Oman,1961-09-13,5,Into good later street mention.
140,iramirez,Bailiwick of Guernsey,1966-12-27,7,First age safe affect though.
141,iramirez,Baker Island,1977-02-16,10,Including artist find hope.
142,iramirez,Iceland,1957-12-03,0,Should represent group strong back approach great top series.
143,iramirez,Belarus,1992-12-20,2,Support law Congress law enough we ask benefit ago.
144,iramirez,Falkland Islands,1953-09-19,9,Identify real to follow so.
145,christinacampbell,Palmyra Atoll,2018-04-28,6,Ball appear television so teach energy possible believe.
146,christinacampbell,Armenia,1961-09-18,10,Grow better why child might source where.
147,christinacampbell,Johnston Atoll,1950-11-30,2,Front war receive civil single city quite.
148,christinacampbell,Panama,1995-06-29,10,Lot thousand question analysis.
149,christinacampbell,Fiji,1983-07-08,0,Forget whom goal clear inside guy.
150,christinacampbell,Argentina,1969-08-05,8,North add us accept hope soon yourself.
151,christinacampbell,Jordan,1953-06-20,5,Station member although since.
152,christinacampbell,Germany,1966-01-16,5,Particularly sing purpose here ago job trial four easy.
153,christinacampbell,Clipperton Island,1969-07-28,4,Member mouth authority imagine probably whom it.
154,christinacampbell,Saint Vincent and the Grenadines,2010-02-27,10,Likely different house population however ok.
155,amandacarlson,Aruba,1985-02-28,7,Those head against particularly listen down.
156,amandacarlson,Malawi,1956-04-19,6,Focus something who blood there any require agree inside.
157,christopher98,Transnistria,2004-04-25,5,Under require page claim future in opportunity you.
158,christopher98,Slovakia,1989-06-05,4,Both happy central group line million approach theory.
159,christopher98,Mexico,1985-11-16,1,Rich foot herself among necessary.
160,christopher98,Bouvet Island,1955-07-25,0,Especially road get car party close issue.
161,christopher98,Rwanda,2005-01-13,9,Away represent race sing nation network college debate.
162,christopher98,Togo,1981-11-17,0,Moment standard ground think.
163,christopher98,Morocco,1990-01-06,1,Range sort trial study significant energy citizen.
164,christopher98,Iceland,2019-01-28,7,Mouth certain heavy science new doctor trip.
165,hmoore,Belgium,2002-05-03,6,Hope likely fill improve image best win.
166,hmoore,Ivory Coast,1970-11-28,7,On plant wonder thing.
167,hmoore,Mauritania,1965-05-08,4,Other owner message entire rule collection.
168,hmoore,Bangladesh,1962-06-08,2,Action throughout stage lose.
169,hmoore,Trinidad and Tobago,1965-07-13,1,Hard recent project speech director city necessary thus.
170,hmoore,The Bahamas,2019-12-14,7,Ago poor coach year important.
171,hmoore,Johnston Atoll,1979-02-18,2,Remain if again care hold those north trouble.
172,hmoore,China,1962-08-17,3,If do them although per environmental medical nearly hour.
173,hmoore,North Macedonia,1986-12-03,2,Discover hair few participant true.
174,christinahernandez,Iran,2012-12-31,10,While long not improve.
175,christinahernandez,Colombia,1963-05-15,5,Lot sport father growth behind probably.
176,christinahernandez,United Kingdom,1958-07-13,4,Only cup almost identify record.
177,christinahernandez,Christmas Island,2017-07-20,1,Use nice themselves gas best.
178,christinahernandez,Bailiwick of Guernsey,1951-07-07,4,Dinner stuff find different many water.
179,christinahernandez,El Salvador,2020-02-01,3,Begin fight institution school white team certainly.
180,christinahernandez,Burkina Faso,1989-12-30,8,Score loss they grow his.
181,christinahernandez,Papua New Guinea,1968-06-02,6,Husband matter likely prevent hear.
182,christinahernandez,Lebanon,1999-08-22,2,Everyone win should research executive black tough building.
183,pwillis,Bulgaria,1971-10-23,3,Usually sea upon full director race wish.
184,pwillis,Senegal,2014-01-28,5,Left very your stock determine human find discussion.
185,pwillis,Djibouti,2021-04-20,0,Begin first through dinner.
186,pwillis,Azerbaijan,2009-07-09,7,Offer American behavior customer.
187,pwillis,Antigua and Barbuda,1995-04-17,3,Both something hair do analysis.
188,chunt,Spain,2002-11-23,2,Above bring painting various current scientist culture ability.
189,chunt,Nauru,2007-04-28,1,Mr unit dinner indeed.
190,chunt,Ivory Coast,2015-06-02,6,Job high she past.
191,chunt,Canada,1987-06-20,1,Old region still quality.
192,chunt,São Tomé and Príncipe,1969-02-06,10,Military edge billion billion agency center sign career debate.
193,chunt,Mauritania,1994-04-21,4,Inside matter nice really listen.
194,chunt,Niger,2020-02-02,3,Like lawyer fund indicate help north friend state.
195,chunt,Norway,1982-08-08,3,Eat lose various agency rich accept if share.
196,melissahurst,Iraq,2011-07-11,2,Involve education little direction exist president.
197,melissahurst,Switzerland,1971-01-25,3,Range could usually piece but arrive garden free.
198,melissahurst,Zambia,1972-08-21,8,Hope could many cold another way sign fund.
199,hamiltonariel,Palmyra Atoll,2021-09-16,4,Rich consumer type Republican organization.
200,hamiltonariel,Iraq,2009-11-20,6,Plant pay together number degree.
201,hamiltonariel,Greenland,2010-11-20,1,Drug toward such new.
202,hamiltonariel,Tunisia,1977-07-17,4,Analysis care kitchen purpose.
203,hamiltonariel,Clipperton Island,1981-04-20,10,Technology serious international position write.
204,hamiltonariel,Greenland,1996-11-01,4,Rate clear newspaper ground just keep production suffer.
205,hamiltonariel,Iraq,2014-08-02,5,Chair senior seem west.
206,hamiltonariel,Andorra,2004-06-11,1,Remain decide happy another image because include now.
207,hamiltonariel,Honduras,2006-10-21,0,Decision above you carry poor majority herself Mr bad.
208,hamiltonariel,Taiwan,2017-11-16,7,Daughter pay growth base.
209,wilsonjessica,Kazakhstan,1953-12-22,8,Pass tend onto when happen letter.
210,wilsonjessica,Cook Islands,1965-10-23,9,Language there wonder him second until direction opportunity very.
211,wilsonjessica,Trinidad and Tobago,1956-10-20,9,Firm once machine western month.
212,wilsonjessica,Svalbard,2009-12-23,10,History the bring parent very card center.
213,wilsonjessica,Georgia (country),1955-01-19,3,Relationship easy picture enough break.
214,wilsonjessica,Tonga,1990-07-03,7,Pattern PM seat my arrive middle add.
215,wilsonjessica,Jamaica,2018-03-31,6,Pm election case yet.
216,wilsonjessica,Zimbabwe,1964-05-01,10,Night western serious edge bit avoid yourself campaign alone.
217,wilsonjessica,Bulgaria,1981-03-20,9,Best student describe concern professional discover cut.
218,vwalker,Lesotho,2010-07-24,7,Citizen result thus wind natural customer letter.
219,vwalker,Germany,1993-07-06,9,Everybody professor show bar standard.
220,vwalker,Greece,1992-10-12,4,Along particularly factor boy Republican without mention.
221,vwalker,Madagascar,1997-12-13,4,Become me story but order leg food fast.
222,vwalker,Sri Lanka,2010-04-14,6,All structure point especially that product.
223,vwalker,Fiji,1993-12-12,5,President explain situation eat thousand might employee argue home.
224,vwalker,Bailiwick of Guernsey,1989-01-15,7,Different week treat mouth threat remain interest college anything.
225,wanda43,Cocos (Keeling) Islands,2015-10-11,2,Air ball better consumer campaign join throw.
226,wanda43,Malta,2000-02-08,8,Including month matter environmental issue recently until clearly.
227,iyates,Cape Verde,1999-06-11,3,Eat determine feeling certainly necessary.
228,iyates,Croatia,1984-11-22,7,Agree discussion star individual third want during nice thing.
229,nicole54,Lebanon,1973-09-05,5,Model similar sometimes talk remember again.
230,nicole54,Johnston Atoll,2013-07-16,6,Artist cold measure defense mouth.
231,nicole54,Cyprus,2017-12-08,4,Camera beat activity stay bank.
232,nicole54,Estonia,1983-11-22,0,Late every include generation how risk throughout.
233,nicole54,"Saint Helena, Ascension and Tristan da Cunha",1972-04-12,5,Drug decide animal take memory attack land late sing.
234,nicole54,Burkina Faso,1969-02-12,4,Phone meeting add challenge project happen white maybe read.
235,nicole54,Haiti,1968-12-31,2,Look safe street current.
236,zking,Laos,2004-10-31,9,List key little fast speak tree give.
237,matthew29,Latvia,2002-08-17,1,Official receive may push serious successful country.
238,matthew29,Colombia,1980-04-06,8,Method meeting space military tonight sing.
239,matthew29,Costa Rica,2019-09-22,2,True else feeling trade money smile create either.
240,matthew29,Norfolk Island,1960-03-04,10,Cut billion eight soldier.
241,matthew29,Rwanda,1950-12-16,5,Vote continue community whole growth speech.
242,matthew29,Bhutan,1952-01-15,10,Again trouble cold thank.
243,crosskevin,Tunisia,1982-12-14,3,Statement scene teach because it boy agent.
244,crosskevin,Eswatini,1974-04-01,5,Order evening scene that.
245,crosskevin,Guyana,2003-01-26,10,Floor somebody many character option.
246,crosskevin,Greenland,2006-04-20,7,Physical treat dinner able job page position possible career.
247,angelablevins,Tuvalu,1962-05-31,10,Financial plan phone step country article will.
248,angelablevins,United States Virgin Islands,1993-11-02,10,Magazine loss tree especially position learn.
249,ostephens,Argentina,1972-07-13,0,Mention next identify language provide.
250,ostephens,Finland,2007-11-11,1,Rather spend similar both significant.
251,ostephens,Canada,1976-02-18,6,Family rock range international everybody book green stay.
252,ostephens,Anguilla,1960-12-25,3,American address simply catch.
253,ostephens,New Zealand,1967-07-15,9,His within though finish star be hot.
254,ostephens,Poland,1981-06-14,1,Decide trip total another.
255,zimmermanbrooke,Moldova,2005-03-03,1,Night reflect image throughout western.
256,michael58,East Timor,1958-04-08,3,There certainly walk camera debate western store office.
257,michael58,Bouvet Island,1989-12-26,7,Education idea across player appear similar.
258,michael58,Iran,1960-05-12,3,Police choice cell seven.
259,michael58,Mauritius,1969-02-17,4,Well according star study form.
260,michael58,French Guiana,1959-05-01,9,Health effect forward magazine.
261,michael58,Honduras,1962-04-18,3,Firm himself idea lose.
262,michael58,Suriname,2008-10-10,6,Available despite popular stock memory challenge audience choose.
263,michael58,"Saint Helena, Ascension and Tristan da Cunha",2003-01-31,10,Break attention environment few voice thank local option five.
264,christina59,Saint Kitts and Nevis,2014-05-04,7,Generation since also himself with garden mention economic.
265,christina59,Maldives,1961-04-14,3,Book itself people nation million born American grow.
266,christina59,Latvia,2000-08-04,8,Game magazine series think industry.
267,christina59,Slovakia,1982-12-15,6,Sea thought raise suggest six claim analysis school.
268,christina59,Albania,1973-04-03,0,Receive rate oil defense agree lawyer perhaps.
269,christina59,Germany,1974-06-01,5,Kid official within nothing tend pick mention hot happy.
270,christina59,Japan,1990-12-29,0,Deep while movie tend those walk.
271,christina59,Transnistria,1983-03-25,7,Front plan focus century service nearly movie report boy.
272,christina59,Panama,2011-08-21,2,Daughter consider group eat soon must toward family.
273,clopez,Chile,1988-01-11,3,Dark such firm again court culture story suggest.
274,clopez,Cuba,2013-03-11,5,Economy explain main sport.
275,clopez,Barbados,2003-04-06,10,Tell boy arrive work.
276,clopez,Costa Rica,1987-01-13,6,Result just nature increase trouble heart watch bed bag.
277,clopez,Abkhazia,1963-03-26,7,Wrong take old former run others believe nor.
278,kim19,Benin,1953-07-24,10,Small statement role before.
279,kim19,Sierra Leone,2004-01-31,0,Sign office until particularly when.
280,kim19,Kingdom of the Netherlands,1977-09-27,4,Far training opportunity difficult candidate direction.
281,fdavid,American Samoa,2018-04-27,6,Certainly pattern daughter carry successful imagine.
282,fdavid,Cocos (Keeling) Islands,1975-08-02,1,That admit Mrs look call.
283,fdavid,Ukraine,1987-09-05,7,Together record system term.
284,fdavid,Austria,1980-10-31,4,Thus station science push.
285,fdavid,Wake Island,2007-09-24,9,Certainly Mrs me wear prove.
286,jamie95,Laos,2012-12-16,5,Professional kind wait PM every religious beyond.
287,jamie95,Maldives,2017-07-10,3,Good open executive experience hotel compare.
288,jamie95,The Gambia,1966-04-20,4,Training believe system resource truth leave institution to movie.
289,jamie95,Morocco,1974-12-28,1,Enter wind heavy anything.
290,jamie95,Iceland,2003-11-23,2,Near sign Republican notice prevent figure kitchen.
291,sherry66,Saudi Arabia,2007-05-31,7,Light hot because movement business pull.
292,sherry66,Namibia,1973-09-01,7,Cut drive out image.
293,phillipramirez,Isle of Man,1979-10-02,6,Cup man course teacher message page nearly mind.
294,phillipramirez,Tanzania,2009-07-23,1,House political energy song policy owner ahead generation shoulder.
295,phillipramirez,Niger,1978-11-02,1,Window key military deep.
296,phillipramirez,Poland,1951-10-08,6,Door line page structure face.
297,phillipramirez,Northern Cyprus,1995-08-06,9,Theory become buy many partner pressure.
298,phillipramirez,Baker Island,1982-02-17,4,Important they tax machine century.
299,phillipramirez,Egypt,2001-03-11,4,Break focus raise away tough.
300,phillipramirez,Hungary,1976-11-22,1,Yes miss interest rise her.
301,phillipramirez,Denmark,1955-08-23,8,Kid explain product money store.
302,phillipramirez,Denmark,2017-05-28,3,Choice chance of enter deep walk cause.
303,johngould,Tanzania,2008-06-30,8,Stuff federal like be happen.
304,johngould,Tuvalu,1964-03-22,6,Management minute air represent sound.
305,johngould,Solomon Islands,1962-07-22,1,Start say either none heavy down business state.
306,johngould,Sudan,2021-04-14,4,West practice physical actually century.
307,johngould,British Virgin Islands,1970-06-13,0,Summer specific option concern black.
308,jonesapril,Curaçao,1963-10-22,6,Performance officer election information among avoid.
309,jonesapril,Svalbard,2012-04-06,8,Get effect imagine town.
310,jonesapril,Luxembourg,1991-03-02,10,Defense become result easy mission laugh.
311,jonesapril,Argentina,1952-04-07,0,Inside mind without represent resource pretty.
312,jonesapril,Malawi,2003-08-27,7,Fear knowledge player down positive.
313,tiffany86,French Polynesia,1992-07-01,9,Happy last hit poor.
314,sjohnson,Jarvis Island,1957-11-20,1,Since experience perform interest particularly notice military civil account.
315,sjohnson,Zimbabwe,1965-05-16,10,Remain cup they enter identify participant environmental.
